{"allowedScope":[".project/run-bundles/shadow-council-reviewer-output-reliability-v1-smoke/**"],"baseCommit":"40f2dc3933547a2620ce706330f9086274059c8c","branch":"fix/shadow-council-reviewer-output-reliability-v1","disposition":"IN_PROGRESS","humanActionRequested":"None -- evidence-only smoke supporting SHADOW-COUNCIL-REVIEWER-OUTPUT-RELIABILITY-V1's section 7 reliability gate.","objective":"Harmless real 3-seat reviewer-contract-compliance smoke (section 7) for the reviewer-output-reliability hardening task. Not a Council architecture decision; grants zero execution/implementation authority.","taskId":"SHADOW-COUNCIL-REVIEWER-OUTPUT-RELIABILITY-V1-SMOKE","taskRecordHash":"sha256:134771ebe8a45a0a8ce527193cf17ae918c289101c74b82b4d6c0c0aed4b251d","unresolvedRisks":["This is a compliance smoke only; any 3/3 or partial APPROVE/REJECT/ABSTAIN outcome grants zero Council authorization for any real MIHVER action."]}
