{"allowedScope":["scripts/dev/shadow-council-cli-transport.mjs","scripts/dev/shadow-council-run-bundle-evidence.mjs","tests/dev/shadow-council-decision-record-evidence.test.mjs","tests/dev/shadow-council-failure-evidence.test.mjs","tests/dev/shadow-council-cli-transport.test.mjs","docs/development/SHADOW_COUNCIL_V1A_EXERCISE.md"],"baseCommit":"3b1ec8f30b2e85b3f07e8cfb2b1274038e02c96b","branch":"fix/shadow-council-contemporaneous-quorum-evidence-v1","disposition":"IN_PROGRESS","humanActionRequested":"Review this smoke Run Bundle and the branch's single local commit. No execution or publication authority is requested or implied.","objective":"Bounded real R2 smoke proving a terminal Council run persists DecisionRequest and CouncilConfig before the first provider invocation, and a contemporaneous CouncilQuorumProof built from those durable artifacts before finalization.","taskId":"SHADOW-COUNCIL-CONTEMPORANEOUS-QUORUM-EVIDENCE-V1","taskRecordHash":"sha256:0640a33220892bab04a7abf9c803160be3c66dca9b1f8d711958de29d6d4545c","unresolvedRisks":["Smoke bundle is advisory evidence; it confers no execution or publication authority."]}
