{"allowedScope":[".project/run-bundles/shadow-council-candidate-gate-reliability-v1-smoke/**"],"baseCommit":"3d90e0eaa9dbd65cd52112c574b1d823c598f0f8","branch":"fix/shadow-council-candidate-gate-reliability-v1","disposition":"COMPLETE_PENDING_HUMAN_REVIEW","humanActionRequested":"Inspect the finalized synthetic smoke evidence; it grants no execution, publication, merge, or authorization authority.","objective":"Run one bounded harmless synthetic R2 candidate-gate smoke with durable evidence.","taskId":"shadow-council-candidate-gate-reliability-v1-smoke","taskRecordHash":"sha256:d92d4b479ff06622d6c2fab4f5a758177d1bba5bcdf3fb36e1d04628469f2eb5","unresolvedRisks":["Real provider responses may reject or fail; no retry or substitution is permitted."]}
