{"allowedScope":[".project/run-bundles/authorization-ledger-v1c-r3-architecture-v8/",".project/CURRENT_TASK.md",".project/DECISIONS_LOG.md",".project/REVIEW_STATE.md","docs/development/SHADOW_COUNCIL_V1A_EXERCISE.md"],"baseCommit":"245957deab85b3a147ad3b8f38c7645628e30059","branch":"decision/authorization-ledger-v1c-r3-architecture-v8","disposition":"IN_PROGRESS","humanActionRequested":"Review the real three-seat R3 V8 architecture Council evidence; no execution, publication, or implementation authority is requested or implied.","objective":"Run a real three-seat R3 architecture Council for Authorization Ledger V8 as advisory evidence only, granting no execution, publication, or implementation authority.","taskId":"AUTHORIZATION-LEDGER-V1C-R3-ARCHITECTURE-DECISION-V8","taskRecordHash":"sha256:9e6badf6028d0f1057f3667468fbe15dd6956b2520804dedf65a2d02ed5fc96e","unresolvedRisks":["Advisory Council evidence only; it confers no execution, publication or implementation authority.","Human R3 pre-authorization remains mandatory."]}
