{"allowedScope":[".project/run-bundles/authorization-ledger-v1c-r3-architecture-v6/**",".project/CURRENT_TASK.md",".project/REVIEW_STATE.md",".project/PROJECT_STATE.md",".project/DECISIONS_LOG.md","docs/development/SHADOW_COUNCIL_V1A_EXERCISE.md"],"baseCommit":"f004daa516e87e9e11dfe87023deb4e0302d3e47","branch":"decision/authorization-ledger-v1c-r3-architecture-v6","disposition":"IN_PROGRESS","humanActionRequested":"Inspect the durably persisted terminal DecisionRecord and per-seat rationale evidence. If 3/3 APPROVE, run a fresh human pre-authorization audit of the exact candidateHash before separately and explicitly authorizing any V1C implementation task.","objective":"Real 3-seat Shadow Council R3 architecture decision (V6) for the V1C privileged Authorization Ledger, human-admin AuthorizationGrant path, trusted Council/evidence import boundary, and persistent global stopEpoch register -- materially revised from V5 to fix V5's human-pre-authorization MATERIAL_ARCHITECTURE_BLOCKER: stopEpoch increment was atomic but not application-level idempotent across commit -> acknowledgment loss -> retry of the same logical ADMIN operation. Architecture decision and durable evidence only; no V1C implementation.","taskId":"authorization-ledger-v1c-r3-arch-decision-6","taskRecordHash":"sha256:25cdff490e6adc4aba9f1d9245fe1d4d01910c89ff70bad68c58b3e249df3d85","unresolvedRisks":["Council-evidence-only exercise: Council approval, even 3/3, grants zero execution or V1C implementation authority.","Rationale evidence is advisory only and does not affect quorum, candidateHash, or DecisionRecord.recordHash.","Human R3 pre-authorization is a separate later gate and is not performed by this task."]}
