{"allowedScope":[".project/run-bundles/authorization-ledger-v1c-r3-architecture-v3/**",".project/CURRENT_TASK.md",".project/REVIEW_STATE.md",".project/PROJECT_STATE.md","docs/development/SHADOW_COUNCIL_V1A_EXERCISE.md"],"baseCommit":"27da4a0708ad7d0a67c7c96ff65849b467372bd6","branch":"decision/authorization-ledger-v1c-r3-architecture-v3","disposition":"IN_PROGRESS","humanActionRequested":"Inspect the persisted DecisionRecord and per-seat rationale evidence; if 3/3 APPROVE, separately and explicitly authorize the exact frozen candidateHash before any V1C implementation task begins.","objective":"Real 3-seat Shadow Council R3 architecture decision for the V1C privileged Authorization Ledger, human-admin AuthorizationGrant path, global stopEpoch register, and trusted Council/evidence import boundary (architecture decision only, no V1C implementation).","taskId":"AUTHORIZATION-LEDGER-V1C-R3-ARCHITECTURE-DECISION-V3","taskRecordHash":"sha256:79e29e1e864f1b2cc52deacc2f32f0c05ddfe893cb7c42a10946135fc1f8c498","unresolvedRisks":["This is a Council-evidence-only exercise; Council approval, even 3/3, grants zero execution or implementation authority for V1C.","Rationale evidence is advisory only and does not affect quorum or DecisionRecord.recordHash."]}
