{"allowedScope":["scripts/dev/shadow-council-run-bundle-evidence.mjs","tests/dev/shadow-council-decision-record-evidence.test.mjs","tests/dev/shadow-council-failure-evidence.test.mjs","docs/development/SHADOW_COUNCIL_V1A_EXERCISE.md"],"baseCommit":"f05d01f766e74abdeaac8e8fe9b6835eb366a83e","branch":"fix/shadow-council-decision-record-persistence-v1","disposition":"COMPLETE_PENDING_HUMAN_REVIEW","humanActionRequested":"Review this smoke-exercise Run Bundle and the branch's local commit; no execution/publication authority is requested or implied.","objective":"Real bounded smoke exercise proving a real terminal Council result now leaves a durable DecisionRecord evidence entry before Run Bundle finalization.","taskId":"SHADOW-COUNCIL-DECISION-RECORD-PERSISTENCE-V1","taskRecordHash":"sha256:5a1fdb0682d8d9aaa259d8cdacd09163c64290f1b756da6014b53e68cb780889","unresolvedRisks":[]}
