{"allowedScope":["schemas/dev/authorization-envelope.schema.json","schemas/dev/authorization-grant.schema.json","schemas/dev/authorization-ledger-result.schema.json","schemas/dev/authorization-loop-record.schema.json","schemas/dev/fake-execution-record.schema.json","scripts/dev/authorization-binder.mjs","scripts/dev/authorization-ledger-simulator.mjs","scripts/dev/authorization-loop.mjs","scripts/dev/authorization-verifier.mjs","scripts/dev/fake-executor.mjs","tests/dev/authorization-binder.test.mjs","tests/dev/authorization-ledger-simulator.test.mjs","tests/dev/authorization-loop.test.mjs","tests/dev/fake-executor.test.mjs","scripts/dev/authorization-loop-demonstration.mjs","docs/development/AUTHORIZATION_LOOP_V1A_DEMONSTRATION.md",".project/run-bundles/authorization-loop-v1a-demonstration/"],"baseCommit":"9fe907a87401adae6fe3e4eb443db770dff87678","branch":"feat/authorization-loop-foundation-v1a","disposition":"COMPLETE_PENDING_HUMAN_REVIEW","forbiddenScope":["scripts/dev/run-bundle.mjs","scripts/dev/run-bundle-report.mjs","scripts/dev/project-context-pack.mjs","scripts/dev/decision-council-kernel.mjs","scripts/dev/council-quorum-proof.mjs","schemas/dev/decision-council.schema.json","schemas/dev/council-quorum-proof.schema.json","docs/adr/ADR-0005-DECISION-COUNCIL-PROTOCOL.md"],"humanActionRequested":"Review the finalized typed evidence and decide whether the demonstrated Phase 3/4 foundation is acceptable for the task to proceed. This request does not authorize execution, publication, push, pull-request creation, or merge.","objective":"Record finalized Run Bundle evidence for the R2-classified AUTHORIZATION-LOOP-FOUNDATION-V1A Phase 3/4 deterministic demonstration: Authorization Binder and Ledger Simulator integration with CouncilQuorumProof, bounded Authorization Loop behavior, STOP-epoch fencing, R3 exact-bound human grants and replay denial, blocked-task and R4/NO_QUORUM denial paths, and FakeExecutor-only effects. This record describes deterministic evidence only and grants no execution or publication authority.","taskId":"AUTHORIZATION-LOOP-FOUNDATION-V1A","taskRecordHash":"sha256:fcb72fc3cf852a1b9be7361b604ec20f494491d2665024df1594e4a774d0b2ca","unresolvedRisks":["The demonstration proves only deterministic in-process behavior with FakeExecutor; it does not establish or grant authority for shell, Git, network, provider, Publication Broker, or other real-world effects.","The ProjectContextPack is valid but records a dirty working tree and executionEligible false; the bundle binds the exact current HEAD and context snapshot as evidence, not as execution authority."]}
