{"allowedScope":[".project/run-bundles/authorization-ledger-v1c-r3-architecture-v7/**",".project/CURRENT_TASK.md",".project/REVIEW_STATE.md",".project/PROJECT_STATE.md",".project/DECISIONS_LOG.md","docs/development/SHADOW_COUNCIL_V1A_EXERCISE.md"],"baseCommit":"2e42febe088e5e6bdff61431cd964dd2a3f2fcd8","branch":"decision/authorization-ledger-v1c-r3-architecture-v7","disposition":"IN_PROGRESS","humanActionRequested":"Inspect the durably persisted terminal DecisionRecord, the 17-entry yesNoMatrix in the frozen candidate, and the per-seat rationale evidence. If 3/3 APPROVE, run a fresh human pre-authorization audit of the exact candidateHash before separately and explicitly authorizing any V1C implementation task.","objective":"Real 3-seat Shadow Council R3 architecture decision (V7) for the V1C privileged Authorization Ledger, human-admin AuthorizationGrant path, trusted Council/evidence import boundary, and persistent global stopEpoch register. V7 is a narrow successor to V6: V6's substantive architecture is preserved unchanged, and the sole required material revision is an exact 17-of-17 independently represented mandatory yes/no matrix, replacing V6's 15-of-17 matrix which collapsed the distinct Claude and Codex questions and caused NO_QUORUM. Architecture decision and durable evidence only; no V1C implementation is authorized.","taskId":"authorization-ledger-v1c-r3-arch-decision-7","taskRecordHash":"sha256:8f59b71e9a42127893334df92407e3d4a0a756718f91adf4dbdb9f47869d980c","unresolvedRisks":["Council-evidence-only exercise: Council approval, even 3/3, grants zero execution or V1C implementation authority.","Rationale evidence is advisory only and does not affect quorum, candidateHash, or DecisionRecord.recordHash.","Human R3 pre-authorization is a separate later gate and is not performed by this task."]}
