{"allowedScope":[".project/run-bundles/authorization-ledger-v1c-r3-architecture-v4/**",".project/CURRENT_TASK.md",".project/REVIEW_STATE.md",".project/PROJECT_STATE.md","docs/development/SHADOW_COUNCIL_V1A_EXERCISE.md"],"baseCommit":"9eb19a4fc5c1aa56748e63f29f3d5fea29f711b7","branch":"decision/authorization-ledger-v1c-r3-architecture-v4","disposition":"IN_PROGRESS","humanActionRequested":"Inspect the persisted DecisionRecord and per-seat rationale evidence; if 3/3 APPROVE, separately and explicitly authorize the exact frozen candidateHash before any V1C implementation task begins.","objective":"Real 3-seat Shadow Council R3 architecture decision (V4) for the V1C privileged Authorization Ledger, human-admin AuthorizationGrant path, global stopEpoch register, and trusted Council/evidence import boundary -- materially revised from V3 to fix the zero-consumer contradiction, stopEpoch authority gap, and privilege-separation vagueness identified in V3's valid REJECT rationale. Architecture decision only, no V1C implementation.","taskId":"authorization-ledger-v1c-r3-arch-decision-4","taskRecordHash":"sha256:df726625eba7edb68e56417aba7b4df4dc7261c33c961679eba89f6629b0d10b","unresolvedRisks":["This is a Council-evidence-only exercise; Council approval, even 3/3, grants zero execution or implementation authority for V1C.","Rationale evidence is advisory only and does not affect quorum or DecisionRecord.recordHash."]}
