{"allowedScope":[".project/run-bundles/authorization-ledger-v1c-r3-architecture-v5/**",".project/CURRENT_TASK.md",".project/REVIEW_STATE.md",".project/PROJECT_STATE.md","docs/development/SHADOW_COUNCIL_V1A_EXERCISE.md"],"baseCommit":"8bf80782c94029264605e74015582e74eb17e240","branch":"decision/authorization-ledger-v1c-r3-architecture-v5","disposition":"IN_PROGRESS","humanActionRequested":"Inspect the persisted DecisionRecord and per-seat rationale evidence; if 3/3 APPROVE, separately and explicitly authorize the exact frozen candidateHash before any V1C implementation task begins.","objective":"Real 3-seat Shadow Council R3 architecture decision (V5) for the V1C privileged Authorization Ledger, human-admin AuthorizationGrant path, global stopEpoch register, and trusted Council/evidence import boundary -- materially revised from V4 to fix both of decision-4's valid seat-openai REJECT findings: (1) stopEpoch unsigned-64/SQLite-signed-int64 mismatch incompatible with the frozen canonical JSON/BigInt-rejecting hashing path, and (2) SO_PEERCRED supplementary-group membership treated as an authorization decision rather than a reachability check. Architecture decision only, no V1C implementation.","taskId":"authorization-ledger-v1c-r3-arch-decision-5","taskRecordHash":"sha256:0868a0642c24b4ecd526e8c8b6417cd3b4282f333a8530e9efb96e6b6cb76c75","unresolvedRisks":["This is a Council-evidence-only exercise; Council approval, even 3/3, grants zero execution or implementation authority for V1C.","Rationale evidence is advisory only and does not affect quorum or DecisionRecord.recordHash."]}
