{"allowedScope":["scripts/dev/shadow-council-*.mjs","schemas/dev/shadow-*.schema.json","tests/dev/shadow-council-*.test.mjs","docs/development/SHADOW_COUNCIL_V1A_EXERCISE.md"],"baseCommit":"2c87a5780e81e832d9074dd2b74401b8a0caf2e6","branch":"feat/shadow-council-vote-rationale-v1b","disposition":"COMPLETE_PENDING_HUMAN_REVIEW","humanActionRequested":"Review this smoke-exercise Run Bundle and the branch's local commit; no execution/publication authority is requested or implied.","objective":"Persist Shadow Council vote rationale as advisory evidence; real bounded smoke exercise proving the {voteValue,rationale} contract with all three real CLI adapters.","taskId":"SHADOW-COUNCIL-VOTE-RATIONALE-V1B","taskRecordHash":"sha256:8c84c78329ad3f6978844145b0a5f8b3406a4ea6d10572cea0490d8d566acb0d","unresolvedRisks":[]}
