{"allowedScope":["schemas/dev/shadow-decision-packet.schema.json","schemas/dev/shadow-seat-attestation.schema.json","scripts/dev/shadow-council-attestation.mjs","scripts/dev/shadow-council-cli-transport.mjs","scripts/dev/shadow-council-harness.mjs","scripts/dev/shadow-council-packet.mjs","tests/dev/shadow-council-attestation.test.mjs","tests/dev/shadow-council-cli-transport.test.mjs","tests/dev/shadow-council-harness.test.mjs","tests/dev/shadow-council-packet.test.mjs","package.json","docs/development/SHADOW_COUNCIL_V1A_EXERCISE.md",".project/run-bundles/shadow-council-v1a-cli-harness-remediated/",".project/CURRENT_TASK.md",".project/REVIEW_STATE.md"],"baseCommit":"2fae893d89c8debded14fb7ba23adfcad2055133","branch":"feat/shadow-council-v1a-cli-harness-remediated","disposition":"COMPLETE_PENDING_HUMAN_REVIEW","forbiddenScope":["scripts/dev/decision-council-kernel.mjs","scripts/dev/decision-council-simulator.mjs","scripts/dev/canonical-json.mjs","schemas/dev/decision-council.schema.json","scripts/dev/run-bundle.mjs","docs/adr/ADR-0005-DECISION-COUNCIL-PROTOCOL.md",".project/PROJECT_STATE.md",".project/DECISIONS_LOG.md"],"humanActionRequested":"Review this finalized evidence (Run Bundle, durable exercise document, both sanitized real exercise records, Reviewer and Verifier results) and decide, as two separate explicit decisions: (1) whether to push this branch and open/merge a PR, and (2) whether this evidence should move ADR-0005 toward Status: Accepted. Neither is authorized or decided by this task.","objective":"Recover the technically-valid but lifecycle-invalid Shadow Council V1A CLI harness result (quarantined local commit 5d83aa5 on the separate branch feat/shadow-council-v1a-cli-harness, produced by a research fork that exceeded its delegated read-only scope) by re-implementing the same, already-reviewed architecture through compliant provenance (Codex Scout -> Codex Implementer -> Codex Reviewer -> Codex Verifier, Claude as orchestrator/adjudicator/integrator only), then running exactly two real, human-launched Shadow Council exercises (one R1, one R2) against the frozen, unmodified Decision Council V1A kernel, then finalizing that evidence into a fresh Run Bundle and durable exercise document, obtaining a post-exercise adversarial review against all seven ADR-0005 Acceptance Gate criteria and a final independent verification, and preparing exactly one local publication commit. Does not change the Decision Council protocol's topology, quorum rules, candidate/vote binding, DecisionRecord meaning, kernel, simulator, or schema. Does not change ADR-0005's Status (remains Proposed). Does not start ADR-0005 acceptance or execution integration. Does not push, open/modify a PR, or merge.","taskId":"SHADOW-COUNCIL-V1A-LIFECYCLE-REMEDIATION","taskRecordHash":"sha256:d33064dbda8b1fdd5c37073d244b96b7260717b73d559e25876232a3d79d4b4b","unresolvedRisks":["One parent harness process (this Claude Code orchestrator, on this machine) controlled all three child-process launches for both exercises; seat-origin attestation proves local runtime/process separation only, not cryptographic provider non-collusion.","The codex and agy CLIs report no per-model usage breakdown or model identifier at all (reportedModelId: null, modelUsage: {}) on any call; this is recorded honestly as unavailable, never fabricated as confirmation.","agy's JSON output exposes no tool-call field, so its observedToolUsage is structurally always empty -- a real observability gap, not proof that no tool was used.","A real child process's pid is not observable via execFileSync on a successful call; childProcessId records 0 as a sentinel, not a genuine pid.","R1 and R2 bind two different ProjectContextPack contextHash values (repositoryHead identical) because Exercise 1's output file changed the working tree before Exercise 2 compiled its own live ContextPack; disclosed as an operational/evaluation limitation, independently judged by a fresh adversarial Reviewer to not affect protocol integrity or candidate/vote meaning.","The sanitized exercise JSON files do not retain the kernel's internal transitionLog, so they are not a fully self-contained event-log transcript; the Reviewer judged the recorded operator command, attestations, candidate binding, votes, and terminal records collectively sufficient evidence of protocol traversal, and recommended (not required) preserving transitionLog in future exercise output.","The quarantined commit 5d83aa5 on branch feat/shadow-council-v1a-cli-harness is not incorporated into this branch's history, evidence authority, or Run Bundle in any way; it is cited only as historical/reference material in documentation."]}
